SERIES,Denmark,Finland,Iceland,Norway,OECD 2030-target,Sweden
Non-performing loans to total gross loans (%),1.40573,1.45018,2.90217,0.736074,1,0.513361
Return on assets  (%),0.299667,0.488344,0.942206,1.11433,2,0.712753
Regulatory capital to assets (%),4.64547,6.14252,15.3815,,12,5.66657
Non-performing loans net of provisions to capital (%),14.0648,9.67393,5.56401,0.298486,2,2.6261
Regulatory Tier 1 capital to risk-weighted assets (%),20.6069,18.5584,22.4124,22.0244,22,21.136
Liquid assets to short term liabilities (%),59.3228,21.727,23.6479,18.8738,130,23.1697
Net open position in foreign exchange to capital (%),-2.47281,,2.25583,,-24,0.562118
